;Acao;Data;Hora;Descrição;Link
0;EMBR3;30/06/2022;18:05;Embraer assina acordo com a Toyota para potencializar ganhos de eficiência em sistema produtivo;https://www.rad.cvm.gov.br/ENET/frmDownloadDocumento.aspx?Tela=ext&numProtocolo=994350&descTipo=IPE&CodigoInstituicao=1
1;EMBR3;24/06/2022;10:06;Embraer assina contrato firme para conversão de 10 aeronaves cargueiras;https://www.rad.cvm.gov.br/ENET/frmDownloadDocumento.aspx?Tela=ext&numProtocolo=992840&descTipo=IPE&CodigoInstituicao=1
2;EMBR3;23/05/2022;22:02;Contrato KC-390 Millennium;https://www.rad.cvm.gov.br/ENET/frmDownloadDocumento.aspx?Tela=ext&numProtocolo=984378&descTipo=IPE&CodigoInstituicao=1
3;EMBR3;10/05/2022;09:43;Eve Holding, Inc. começa hoje a negociar na Bolsa de Valores de Nova York sob o símbolo ?EVEX?;https://www.rad.cvm.gov.br/ENET/frmDownloadDocumento.aspx?Tela=ext&numProtocolo=979080&descTipo=IPE&CodigoInstituicao=1
4;EMBR3;09/05/2022;09:09;Conclusão da combinação de negócios Eve ? Zanite;https://www.rad.cvm.gov.br/ENET/frmDownloadDocumento.aspx?Tela=ext&numProtocolo=978370&descTipo=IPE&CodigoInstituicao=1
5;EMBR3;06/05/2022;20:28;Aprovação da Combinação de Negócios Eve ? Zanite;https://www.rad.cvm.gov.br/ENET/frmDownloadDocumento.aspx?Tela=ext&numProtocolo=978187&descTipo=IPE&CodigoInstituicao=1
6;EMBR3;02/05/2022;19:18;Parceria Estratégica;https://www.rad.cvm.gov.br/ENET/frmDownloadDocumento.aspx?Tela=ext&numProtocolo=975512&descTipo=IPE&CodigoInstituicao=1
7;EMBR3;29/04/2022;11:22;Eve apresenta atualizações dos negócios em preparação para a conclusão da combinação de negócios com a Zanite;https://www.rad.cvm.gov.br/ENET/frmDownloadDocumento.aspx?Tela=ext&numProtocolo=973252&descTipo=IPE&CodigoInstituicao=1
8;EMBR3;29/04/2022;10:49;Eve apresenta atualizações dos negócios em preparação para a conclusão da combinação de negócios com a Zanite;https://www.rad.cvm.gov.br/ENET/frmDownloadDocumento.aspx?Tela=ext&numProtocolo=973219&descTipo=IPE&CodigoInstituicao=1
9;EMBR3;20/04/2022;13:14;Embraer entrega último caça AF-1B modernizado à Marinha do Brasil;https://www.rad.cvm.gov.br/ENET/frmDownloadDocumento.aspx?Tela=ext&numProtocolo=968705&descTipo=IPE&CodigoInstituicao=1
10;EMBR3;19/04/2022;08:49;Embraer entrega seis jatos comerciais e oito executivos no 1T22;https://www.rad.cvm.gov.br/ENET/frmDownloadDocumento.aspx?Tela=ext&numProtocolo=968222&descTipo=IPE&CodigoInstituicao=1
11;EMBR3;14/04/2022;09:39;Eve UAM, LLC e Zanite Acquisition Corp. anunciam apresentação da versão final do manual de participação em assembleia (proxy statement);https://www.rad.cvm.gov.br/ENET/frmDownloadDocumento.aspx?Tela=ext&numProtocolo=967330&descTipo=IPE&CodigoInstituicao=1
12;EMBR3;12/04/2022;22:49; Aprovação de celebrações de contrato equity swap;https://www.rad.cvm.gov.br/ENET/frmDownloadDocumento.aspx?Tela=ext&numProtocolo=966898&descTipo=IPE&CodigoInstituicao=1
13;EMBR3;31/03/2022;16:12;Embraer arquiva o Relatório 20-F 2021;https://www.rad.cvm.gov.br/ENET/frmDownloadDocumento.aspx?Tela=ext&numProtocolo=962087&descTipo=IPE&CodigoInstituicao=1
14;EMBR3;18/03/2022;07:00;Eve e Acciona anunciam parceria estratégica para acelerar desenvolvimento de ecossistema de Mobilidade Aérea Urbana sustentável;https://www.rad.cvm.gov.br/ENET/frmDownloadDocumento.aspx?Tela=ext&numProtocolo=955566&descTipo=IPE&CodigoInstituicao=1
15;EMBR3;16/03/2022;08:59;Eve e Global Crossing Airlines assinam Carta de Intenção para até 200 aeronaves eVTOL e futura colaboração em Mobilidade Aérea Urbana;https://www.rad.cvm.gov.br/ENET/frmDownloadDocumento.aspx?Tela=ext&numProtocolo=954512&descTipo=IPE&CodigoInstituicao=1
16;EMBR3;09/03/2022;19:19;Divulgação das Estimativas da Companhia para 2022;https://www.rad.cvm.gov.br/ENET/frmDownloadDocumento.aspx?Tela=ext&numProtocolo=951908&descTipo=IPE&CodigoInstituicao=1
17;EMBR3;09/03/2022;09:03;Conflito Russia-Ucrania;https://www.rad.cvm.gov.br/ENET/frmDownloadDocumento.aspx?Tela=ext&numProtocolo=951585&descTipo=IPE&CodigoInstituicao=1
18;EMBR3;25/02/2022;08:40;Resultados Parciais da Oferta no Exterior de Recompra de Bonds;https://www.rad.cvm.gov.br/ENET/frmDownloadDocumento.aspx?Tela=ext&numProtocolo=947619&descTipo=IPE&CodigoInstituicao=1
19;EMBR3;23/02/2022;08:38;Embraer e Air Peace assinam acordo de serviços para a frota de E-Jets-E2;https://www.rad.cvm.gov.br/ENET/frmDownloadDocumento.aspx?Tela=ext&numProtocolo=946385&descTipo=IPE&CodigoInstituicao=1
20;EMBR3;21/02/2022;08:14;Embraer entrega 55 jatos no 4T21 e 141 jatos no total em 2021;https://www.rad.cvm.gov.br/ENET/frmDownloadDocumento.aspx?Tela=ext&numProtocolo=945676&descTipo=IPE&CodigoInstituicao=1
21;EMBR3;18/02/2022;19:39;Aprovação, Alteração ou Desistência de Projeto;https://www.rad.cvm.gov.br/ENET/frmDownloadDocumento.aspx?Tela=ext&numProtocolo=945517&descTipo=IPE&CodigoInstituicao=1
22;EMBR3;16/02/2022;20:10;Embraer, Widerøe e Rolls-Royce anunciam parceria para pesquisa de inovações tecnológicas em aeronaves regionais sustentáveis ;https://www.rad.cvm.gov.br/ENET/frmDownloadDocumento.aspx?Tela=ext&numProtocolo=944569&descTipo=IPE&CodigoInstituicao=1
23;EMBR3;15/02/2022;19:14;ri.embraer.com.br;https://www.rad.cvm.gov.br/ENET/frmDownloadDocumento.aspx?Tela=ext&numProtocolo=944108&descTipo=IPE&CodigoInstituicao=1
24;EMBR3;11/02/2022;09:38;Oferta no Exterior de Recompra de Bonds;https://www.rad.cvm.gov.br/ENET/frmDownloadDocumento.aspx?Tela=ext&numProtocolo=942098&descTipo=IPE&CodigoInstituicao=1
25;EMBR3;10/02/2022;09:04;Eve formaliza processo para Certificação de Tipo do eVTOL junto à ANAC ;https://www.rad.cvm.gov.br/ENET/frmDownloadDocumento.aspx?Tela=ext&numProtocolo=941035&descTipo=IPE&CodigoInstituicao=1
26;EMBR3;09/02/2022;18:35;Aditivos Contratuais;https://www.rad.cvm.gov.br/ENET/frmDownloadDocumento.aspx?Tela=ext&numProtocolo=940626&descTipo=IPE&CodigoInstituicao=1
27;EMBR3;31/01/2022;09:27;EmbraerX assina contrato de serviços com a Jet Flight Service para o uso do Beacon ;https://www.rad.cvm.gov.br/ENET/frmDownloadDocumento.aspx?Tela=ext&numProtocolo=936709&descTipo=IPE&CodigoInstituicao=1
28;EMBR3;26/01/2022;08:16;Embraer conclui com sucesso reintegração do negócio de Aviação Comercial;https://www.rad.cvm.gov.br/ENET/frmDownloadDocumento.aspx?Tela=ext&numProtocolo=935517&descTipo=IPE&CodigoInstituicao=1
29;EMBR3;24/01/2022;09:09;Azorra encomenda 20 aeronaves Embraer E2;https://www.rad.cvm.gov.br/ENET/frmDownloadDocumento.aspx?Tela=ext&numProtocolo=935055&descTipo=IPE&CodigoInstituicao=1
30;EMBR3;12/01/2022;08:24;Embraer e Aernnova anunciam parceria estratégica em Évora;https://www.rad.cvm.gov.br/ENET/frmDownloadDocumento.aspx?Tela=ext&numProtocolo=932924&descTipo=IPE&CodigoInstituicao=1
31;EMBR3;12/01/2022;08:02;Parceria Estratégica;https://www.rad.cvm.gov.br/ENET/frmDownloadDocumento.aspx?Tela=ext&numProtocolo=932921&descTipo=IPE&CodigoInstituicao=1
32;EMBR3;11/01/2022;09:07;Eve e Falko firmam parceria para desenvolver uma rede global de operadores com um pedido potencial para 200 eVTOLs;https://www.rad.cvm.gov.br/ENET/frmDownloadDocumento.aspx?Tela=ext&numProtocolo=932669&descTipo=IPE&CodigoInstituicao=1
33;EMBR3;21/12/2021;09:41;BAE Systems e Embraer irão explorar potenciais variantes de defesa para o eVTOL da Eve;https://www.rad.cvm.gov.br/ENET/frmDownloadDocumento.aspx?Tela=ext&numProtocolo=927770&descTipo=IPE&CodigoInstituicao=1
34;EMBR3;21/12/2021;09:30;Eve and SkyWest Announce Partnership to Develop Regional Operator Network with an order for 100 eVTOL aircraft;https://www.rad.cvm.gov.br/ENET/frmDownloadDocumento.aspx?Tela=ext&numProtocolo=927766&descTipo=IPE&CodigoInstituicao=1
35;EMBR3;21/12/2021;09:19;Eve e Republic Airways anunciam parceria para desenvolver as operações regionais do futuro com um pedido de até 200 eVTOL;https://www.rad.cvm.gov.br/ENET/frmDownloadDocumento.aspx?Tela=ext&numProtocolo=927761&descTipo=IPE&CodigoInstituicao=1
36;EMBR3;21/12/2021;09:08;Eve e Azorra assinam parceria com pedido de 200 eVTOLs;https://www.rad.cvm.gov.br/ENET/frmDownloadDocumento.aspx?Tela=ext&numProtocolo=927755&descTipo=IPE&CodigoInstituicao=1
37;EMBR3;21/12/2021;08:13;Eve, da Embraer, terá ações negociadas na NYSE por meio de uma combinação de negócios com a Zanite Acquisition Corp;https://www.rad.cvm.gov.br/ENET/frmDownloadDocumento.aspx?Tela=ext&numProtocolo=927745&descTipo=IPE&CodigoInstituicao=1
38;EMBR3;21/12/2021;08:13;Celebração de contrato de combinação de negócios ;https://www.rad.cvm.gov.br/ENET/frmDownloadDocumento.aspx?Tela=ext&numProtocolo=927746&descTipo=IPE&CodigoInstituicao=1
39;EMBR3;14/12/2021;09:12;Embraer e Organização Holandesa de Pesquisa Científica Aplicada (TNO) assinam Memorando de Entendimento para pesquisa e desenvolvimento tecnológico em defesa;https://www.rad.cvm.gov.br/ENET/frmDownloadDocumento.aspx?Tela=ext&numProtocolo=925735&descTipo=IPE&CodigoInstituicao=1
40;EMBR3;06/12/2021;10:21;Eve e Sydney Seaplanes anunciam parceria para criar serviços de UAM em Sydney, Austrália, com um pedido inicial de 50 eVTOLs;https://www.rad.cvm.gov.br/ENET/frmDownloadDocumento.aspx?Tela=ext&numProtocolo=922572&descTipo=IPE&CodigoInstituicao=1
41;EMBR3;04/12/2021;11:14;Eve, da Embraer, e Nautilus Aviation firmam parceria para desenvolver operações de Mobilidade Aérea Urbana na Austrália;https://www.rad.cvm.gov.br/ENET/frmDownloadDocumento.aspx?Tela=ext&numProtocolo=922512&descTipo=IPE&CodigoInstituicao=1
42;EMBR3;30/11/2021;18:41;Aprovação em AGE - cisão e incorporação da parcela cindida da Yabora indústria Aeronáutica SA;https://www.rad.cvm.gov.br/ENET/frmDownloadDocumento.aspx?Tela=ext&numProtocolo=921054&descTipo=IPE&CodigoInstituicao=1
43;EMBR3;30/11/2021;09:09;Embraer e Pratt & Whitney firmam parceria para o programa de demonstração de voo de combustível de aviação 100% sustentável;https://www.rad.cvm.gov.br/ENET/frmDownloadDocumento.aspx?Tela=ext&numProtocolo=920858&descTipo=IPE&CodigoInstituicao=1
44;EMBR3;23/11/2021;09:35;Embraer e Centro Aeroespacial da Holanda assinam MoU para colaboração estratégica em pesquisa aeroespacial;https://www.rad.cvm.gov.br/ENET/frmDownloadDocumento.aspx?Tela=ext&numProtocolo=919560&descTipo=IPE&CodigoInstituicao=1
45;EMBR3;19/11/2021;10:48;OGMA reforça colaboração com a Pratt & Whitney na manutenção dos motores GTF;https://www.rad.cvm.gov.br/ENET/frmDownloadDocumento.aspx?Tela=ext&numProtocolo=918830&descTipo=IPE&CodigoInstituicao=1
46;EMBR3;15/11/2021;08:21;Embraer anuncia contrato com a Overland Airways para até seis jatos E175;https://www.rad.cvm.gov.br/ENET/frmDownloadDocumento.aspx?Tela=ext&numProtocolo=917160&descTipo=IPE&CodigoInstituicao=1
47;EMBR3;15/11/2021;06:42;Embraer publica perspectivas de mercado para 20 anos;https://www.rad.cvm.gov.br/ENET/frmDownloadDocumento.aspx?Tela=ext&numProtocolo=917159&descTipo=IPE&CodigoInstituicao=1
48;EMBR3;12/11/2021;09:46;Notícias na mídia - KC 390;https://www.rad.cvm.gov.br/ENET/frmDownloadDocumento.aspx?Tela=ext&numProtocolo=916530&descTipo=IPE&CodigoInstituicao=1
49;EMBR3;12/11/2021;09:24;Embraer e multiSIM colaboram para desenvolver soluções de treinamento em tecnologias inovadoras;https://www.rad.cvm.gov.br/ENET/frmDownloadDocumento.aspx?Tela=ext&numProtocolo=916521&descTipo=IPE&CodigoInstituicao=1
50;EMBR3;11/11/2021;09:12;Embraer inicia a produção do primeiro KC-390 Millennium para a Hungria;https://www.rad.cvm.gov.br/ENET/frmDownloadDocumento.aspx?Tela=ext&numProtocolo=916006&descTipo=IPE&CodigoInstituicao=1
51;EMBR3;10/11/2021;09:11;Eve da Embraer e Widerøe Zero colaboram para desenvolver soluções inovadoras de Mobilidade Aérea Urbana na Escandinávia;https://www.rad.cvm.gov.br/ENET/frmDownloadDocumento.aspx?Tela=ext&numProtocolo=915241&descTipo=IPE&CodigoInstituicao=1
52;EMBR3;08/11/2021;11:54;Embraer apresenta a Energia Family - Quatro Novos Conceitos de Aeronaves Utilizando Tecnologias de Propulsão de Energia Renovável;https://www.rad.cvm.gov.br/ENET/frmDownloadDocumento.aspx?Tela=ext&numProtocolo=914212&descTipo=IPE&CodigoInstituicao=1
53;EMBR3;08/11/2021;08:47;Evento: Sustainability in Action;https://www.rad.cvm.gov.br/ENET/frmDownloadDocumento.aspx?Tela=ext&numProtocolo=914166&descTipo=IPE&CodigoInstituicao=1
54;EMBR3;05/11/2021;07:21;Modificação de Projeções Divulgadas;https://www.rad.cvm.gov.br/ENET/frmDownloadDocumento.aspx?Tela=ext&numProtocolo=913503&descTipo=IPE&CodigoInstituicao=1
55;EMBR3;28/10/2021;18:57; Cisão parcial da subsidiária Yaborã Indústria Aeronáutica S.A., com incorporação da parcela cindida;https://www.rad.cvm.gov.br/ENET/frmDownloadDocumento.aspx?Tela=ext&numProtocolo=910996&descTipo=IPE&CodigoInstituicao=1
56;EMBR3;26/10/2021;09:12;Simulação de mobilidade aérea urbana da Eve no Rio de Janeiro começa em novembro;https://www.rad.cvm.gov.br/ENET/frmDownloadDocumento.aspx?Tela=ext&numProtocolo=910066&descTipo=IPE&CodigoInstituicao=1
57;EMBR3;21/10/2021;14:15;Embraer anuncia acordo de Pool com a KLM Cityhopper para a frota de E195-E2;https://www.rad.cvm.gov.br/ENET/frmDownloadDocumento.aspx?Tela=ext&numProtocolo=909060&descTipo=IPE&CodigoInstituicao=1
58;EMBR3;21/10/2021;08:01;Embraer entrega nove jatos comerciais e 21 executivos no 3T21;https://www.rad.cvm.gov.br/ENET/frmDownloadDocumento.aspx?Tela=ext&numProtocolo=908946&descTipo=IPE&CodigoInstituicao=1
59;EMBR3;20/10/2021;08:00;Embraer Renova Acordo do Programa Pool com a TAP Express;https://www.rad.cvm.gov.br/ENET/frmDownloadDocumento.aspx?Tela=ext&numProtocolo=908588&descTipo=IPE&CodigoInstituicao=1
60;EMBR3;19/10/2021;18:15;EmbraerX assina contrato de prestação de serviços com a Republic Airways para utilização do Beacon;https://www.rad.cvm.gov.br/ENET/frmDownloadDocumento.aspx?Tela=ext&numProtocolo=908408&descTipo=IPE&CodigoInstituicao=1
61;EMBR3;18/10/2021;14:12;Embraer assina Memorando de Entendimento com Fokker Techniek e Fokker Services para busca de oportunidades em Defesa, Desenvolvimento e Suporte ;https://www.rad.cvm.gov.br/ENET/frmDownloadDocumento.aspx?Tela=ext&numProtocolo=908026&descTipo=IPE&CodigoInstituicao=1
62;EMBR3;11/10/2021;08:02;Embraer e NetJets anunciam novo acordo e reforçam relacionamento de mais de uma década;https://www.rad.cvm.gov.br/ENET/frmDownloadDocumento.aspx?Tela=ext&numProtocolo=906963&descTipo=IPE&CodigoInstituicao=1
63;EMBR3;07/10/2021;08:09;BNDES apoia exportação de 24 aviões da Embraer para os Estados Unidos;https://www.rad.cvm.gov.br/ENET/frmDownloadDocumento.aspx?Tela=ext&numProtocolo=905964&descTipo=IPE&CodigoInstituicao=1
64;EMBR3;05/10/2021;10:41;Embraer apoia o compromisso global da indústria de aviação para emissões líquidas zero de carbono até 2050 ;https://www.rad.cvm.gov.br/ENET/frmDownloadDocumento.aspx?Tela=ext&numProtocolo=905374&descTipo=IPE&CodigoInstituicao=1
65;EMBR3;04/10/2021;08:06;Eve e Avantto anunciam parceira para o desenvolvimento de operações de Mobilidade Aérea Urbana no Brasil e na América Latina;https://www.rad.cvm.gov.br/ENET/frmDownloadDocumento.aspx?Tela=ext&numProtocolo=904988&descTipo=IPE&CodigoInstituicao=1
66;EMBR3;01/10/2021;08:47;Embraer dobra as vendas de avião agrícola;https://www.rad.cvm.gov.br/ENET/frmDownloadDocumento.aspx?Tela=ext&numProtocolo=904621&descTipo=IPE&CodigoInstituicao=1
67;EMBR3;28/09/2021;08:11;Embraer prevê que aeronaves regionais liderarão a retomada no mercado da China na era pós-pandemia ;https://www.rad.cvm.gov.br/ENET/frmDownloadDocumento.aspx?Tela=ext&numProtocolo=903876&descTipo=IPE&CodigoInstituicao=1
68;EMBR3;23/09/2021;18:11;EmbraerX e empresa do Vale do Silício se unem para acelerar o futuro da aviação agrícola autônoma;https://www.rad.cvm.gov.br/ENET/frmDownloadDocumento.aspx?Tela=ext&numProtocolo=903010&descTipo=IPE&CodigoInstituicao=1
69;EMBR3;23/09/2021;08:06;Eve, da Embraer, e Bristow firmam parceria para desenvolver operações de UAM com pedido de até 100 eVTOLs;https://www.rad.cvm.gov.br/ENET/frmDownloadDocumento.aspx?Tela=ext&numProtocolo=902923&descTipo=IPE&CodigoInstituicao=1
70;EMBR3;20/09/2021;09:53;Embraer assina novo contrato de serviços com a Alliance Airlines;https://www.rad.cvm.gov.br/ENET/frmDownloadDocumento.aspx?Tela=ext&numProtocolo=902105&descTipo=IPE&CodigoInstituicao=1
71;EMBR3;20/09/2021;08:25;Eve, da Embraer, e Helipass anunciam parceria para operações de Mobilidade Aérea Urbana na França e outros países da Europa ;https://www.rad.cvm.gov.br/ENET/frmDownloadDocumento.aspx?Tela=ext&numProtocolo=902085&descTipo=IPE&CodigoInstituicao=1
72;EMBR3;09/08/2021;18:10;SkyWest encomenda 16 novos E175 para operar com a Delta Air Lines;https://www.rad.cvm.gov.br/ENET/frmDownloadDocumento.aspx?Tela=ext&numProtocolo=890793&descTipo=IPE&CodigoInstituicao=1
73;EMBR3;21/07/2021;08:08;Embraer entrega 14 jatos comerciais e 20 executivos no 2T21;https://www.rad.cvm.gov.br/ENET/frmDownloadDocumento.aspx?Tela=ext&numProtocolo=885189&descTipo=IPE&CodigoInstituicao=1
74;EMBR3;10/06/2021;10:12;Negociações sobre potencial combinação de negocios;https://www.rad.cvm.gov.br/ENET/frmDownloadDocumento.aspx?Tela=ext&numProtocolo=875266&descTipo=IPE&CodigoInstituicao=1
75;EMBR3;07/06/2021;09:13;Eve e Helisul anunciam parceria em Mobilidade Aérea Urbana no Brasil com pedido inicial de até 50 eVTOLs ;https://www.rad.cvm.gov.br/ENET/frmDownloadDocumento.aspx?Tela=ext&numProtocolo=874081&descTipo=IPE&CodigoInstituicao=1
76;EMBR3;12/05/2021;15:13;Grupo Alaska Air encomenda nove novas aeronaves E175 para a Horizon Air;https://www.rad.cvm.gov.br/ENET/frmDownloadDocumento.aspx?Tela=ext&numProtocolo=866468&descTipo=IPE&CodigoInstituicao=1
77;EMBR3;12/05/2021;15:13;SkyWest Airlines encomenda oito novas aeronaves E175 para operação da Alaska Airlines;https://www.rad.cvm.gov.br/ENET/frmDownloadDocumento.aspx?Tela=ext&numProtocolo=866470&descTipo=IPE&CodigoInstituicao=1
78;EMBR3;27/04/2021;08:00;Embraer entrega nove jatos comerciais e 13 executivos no 1T21;https://www.rad.cvm.gov.br/ENET/frmDownloadDocumento.aspx?Tela=ext&numProtocolo=857626&descTipo=IPE&CodigoInstituicao=1
79;EMBR3;08/04/2021;22:10;Embraer arquiva o Relatório Form 20-F ano fiscal 2020;https://www.rad.cvm.gov.br/ENET/frmDownloadDocumento.aspx?Tela=ext&numProtocolo=852124&descTipo=IPE&CodigoInstituicao=1
80;EMBR3;08/04/2021;14:06;Reapresentação do boletim de voto à distância de sua Assembleia Geral Extraordinária;https://www.rad.cvm.gov.br/ENET/frmDownloadDocumento.aspx?Tela=ext&numProtocolo=851831&descTipo=IPE&CodigoInstituicao=1
81;EMBR3;18/02/2021;11:54;Embraer apoia decisão do governo brasileiro em lançar negociações sobre subsídios aeronáuticos;https://www.rad.cvm.gov.br/ENET/frmDownloadDocumento.aspx?Tela=ext&numProtocolo=832899&descTipo=IPE&CodigoInstituicao=1
82;EMBR3;18/02/2021;11:12;Embraer apoia decisão do governo brasileiro em lançar negociações sobre subsídios aeronáuticos;https://www.rad.cvm.gov.br/ENET/frmDownloadDocumento.aspx?Tela=ext&numProtocolo=832895&descTipo=IPE&CodigoInstituicao=1
83;EMBR3;12/02/2021;07:58;Embraer entrega 71 jatos no 4T20 e 130 jatos no total em 2020;https://www.rad.cvm.gov.br/ENET/frmDownloadDocumento.aspx?Tela=ext&numProtocolo=830996&descTipo=IPE&CodigoInstituicao=1
84;EMBR3;13/01/2021;08:15;Congo Airways encomenda dois jatos E195-E2;https://www.rad.cvm.gov.br/ENET/frmDownloadDocumento.aspx?Tela=ext&numProtocolo=822299&descTipo=IPE&CodigoInstituicao=1
85;EMBR3;09/12/2020;11:05;Ataque cibernético;https://www.rad.cvm.gov.br/ENET/frmDownloadDocumento.aspx?Tela=ext&numProtocolo=814257&descTipo=IPE&CodigoInstituicao=1
86;EMBR3;02/12/2020;11:55;Embraer divulga perspectiva de mercado para os próximos 10 anos com as tendências da indústria;https://www.rad.cvm.gov.br/ENET/frmDownloadDocumento.aspx?Tela=ext&numProtocolo=812344&descTipo=IPE&CodigoInstituicao=1
87;EMBR3;30/11/2020;21:33;Divulgação de dados atribuídos à Companhia;https://www.rad.cvm.gov.br/ENET/frmDownloadDocumento.aspx?Tela=ext&numProtocolo=812068&descTipo=IPE&CodigoInstituicao=1
88;EMBR3;17/11/2020;09:57;Hungria assina contrato para aquisição de duas aeronaves multimissão KC-390 Millennium;https://www.rad.cvm.gov.br/ENET/frmDownloadDocumento.aspx?Tela=ext&numProtocolo=809308&descTipo=IPE&CodigoInstituicao=1
89;EMBR3;12/11/2020;21:27;Aquisição de Ações de Emissão da Própria Companhia;https://www.rad.cvm.gov.br/ENET/frmDownloadDocumento.aspx?Tela=ext&numProtocolo=808308&descTipo=IPE&CodigoInstituicao=1
90;EMBR3;12/11/2020;13:41;OGMA, empresa do Grupo Embraer, é novo Centro de Manutenção Autorizado da Pratt & Whitney para motores GTF;https://www.rad.cvm.gov.br/ENET/frmDownloadDocumento.aspx?Tela=ext&numProtocolo=807986&descTipo=IPE&CodigoInstituicao=1
91;EMBR3;20/10/2020;08:00;Embraer entrega sete jatos comerciais e 21 executivos no 3T20;https://www.rad.cvm.gov.br/ENET/frmDownloadDocumento.aspx?Tela=ext&numProtocolo=801405&descTipo=IPE&CodigoInstituicao=1
92;EMBR3;23/09/2020;18:34;Recompra Bonds;https://www.rad.cvm.gov.br/ENET/frmDownloadDocumento.aspx?Tela=ext&numProtocolo=794960&descTipo=IPE&CodigoInstituicao=1
93;EMBR3;08/09/2020;10:09;Recompra Bonds;https://www.rad.cvm.gov.br/ENET/frmDownloadDocumento.aspx?Tela=ext&numProtocolo=791494&descTipo=IPE&CodigoInstituicao=1
94;EMBR3;23/07/2020;08:19;Financiamentos Embraer;https://www.rad.cvm.gov.br/ENET/frmDownloadDocumento.aspx?Tela=ext&numProtocolo=777818&descTipo=IPE&CodigoInstituicao=1
95;EMBR3;20/07/2020;08:00;Embraer entrega quatro jatos comerciais e treze executivos no 2T20;https://www.rad.cvm.gov.br/ENET/frmDownloadDocumento.aspx?Tela=ext&numProtocolo=777185&descTipo=IPE&CodigoInstituicao=1
96;EMBR3;15/07/2020;07:47;Helvetic Airways atualiza pedido para os jatos E2, da Embraer;https://www.rad.cvm.gov.br/ENET/frmDownloadDocumento.aspx?Tela=ext&numProtocolo=776133&descTipo=IPE&CodigoInstituicao=1
97;EMBR3;15/06/2020;18:08;Comunicado ao Mercado - Financiamentos Embraer;https://www.rad.cvm.gov.br/ENET/frmDownloadDocumento.aspx?Tela=ext&numProtocolo=768952&descTipo=IPE&CodigoInstituicao=1
98;EMBR3;01/06/2020;19:45;Embraer arquiva o Relatório Form 20-F ano fiscal 2019;https://www.rad.cvm.gov.br/ENET/frmDownloadDocumento.aspx?Tela=ext&numProtocolo=765743&descTipo=IPE&CodigoInstituicao=1
99;EMBR3;26/05/2020;09:20;Congo Airways altera pedido do Embraer E175 para E190-E2;https://www.rad.cvm.gov.br/ENET/frmDownloadDocumento.aspx?Tela=ext&numProtocolo=764359&descTipo=IPE&CodigoInstituicao=1
