;Acao;Data;Hora;Descrição;Link
0;MYPK3;20/08/2021;17:26;Rating Standard & Poor´s ;https://www.rad.cvm.gov.br/ENET/frmDownloadDocumento.aspx?Tela=ext&numProtocolo=895440&descTipo=IPE&CodigoInstituicao=1
1;MYPK3;14/07/2021;22:19;Trânsito em julgado de ação sobre exclusão do valor do ICMS da base de cálculo do PIS e da COFINS e Possibilidade de acordo extrajudicial sobre autuação fiscal em controlada mexicana;https://www.rad.cvm.gov.br/ENET/frmDownloadDocumento.aspx?Tela=ext&numProtocolo=883957&descTipo=IPE&CodigoInstituicao=1
2;MYPK3;27/04/2021;19:00;Sustainability-Linked notes units ;https://www.rad.cvm.gov.br/ENET/frmDownloadDocumento.aspx?Tela=ext&numProtocolo=857979&descTipo=IPE&CodigoInstituicao=1
3;MYPK3;22/04/2021;08:50;Avaliação da viabilidade de realizar uma captação de recursos no mercado internacional (Sustainability-linked notes);https://www.rad.cvm.gov.br/ENET/frmDownloadDocumento.aspx?Tela=ext&numProtocolo=856069&descTipo=IPE&CodigoInstituicao=1
4;MYPK3;16/04/2021;18:05;Assembleia de Debenturistas - Aprovação concessão de renúncia e perdão prévios para a eventual não observância pela Companhia de índices financeiros;https://www.rad.cvm.gov.br/ENET/frmDownloadDocumento.aspx?Tela=ext&numProtocolo=854677&descTipo=IPE&CodigoInstituicao=1
5;MYPK3;31/03/2021;22:02;Convocação de Assembleias Gerais de Debenturistas;https://www.rad.cvm.gov.br/ENET/frmDownloadDocumento.aspx?Tela=ext&numProtocolo=849393&descTipo=IPE&CodigoInstituicao=1
6;MYPK3;17/12/2020;18:50;Relatório de Sustentabilidade e CDP;https://www.rad.cvm.gov.br/ENET/frmDownloadDocumento.aspx?Tela=ext&numProtocolo=817720&descTipo=IPE&CodigoInstituicao=1
7;MYPK3;13/11/2020;18:03;Participação em evento público ao vivo com transmissão online (Live);https://www.rad.cvm.gov.br/ENET/frmDownloadDocumento.aspx?Tela=ext&numProtocolo=808613&descTipo=IPE&CodigoInstituicao=1
8;MYPK3;13/08/2020;17:17;Reestruturação na América do Norte;https://www.rad.cvm.gov.br/ENET/frmDownloadDocumento.aspx?Tela=ext&numProtocolo=784489&descTipo=IPE&CodigoInstituicao=1
9;MYPK3;26/06/2020;17:39;Assembleia Geral de Debenturistas;https://www.rad.cvm.gov.br/ENET/frmDownloadDocumento.aspx?Tela=ext&numProtocolo=771675&descTipo=IPE&CodigoInstituicao=1
10;MYPK3;09/06/2020;22:20;Convocação de Assembleia de Debenturistas;https://www.rad.cvm.gov.br/ENET/frmDownloadDocumento.aspx?Tela=ext&numProtocolo=767737&descTipo=IPE&CodigoInstituicao=1
11;MYPK3;30/03/2020;08:41;3ª emissão de notas promissórias comerciais;https://www.rad.cvm.gov.br/ENET/frmDownloadDocumento.aspx?Tela=ext&numProtocolo=749584&descTipo=IPE&CodigoInstituicao=1
12;MYPK3;20/03/2020;21:03;Medidas adotadas em relação ao novo coronavírus (COVID-19);https://www.rad.cvm.gov.br/ENET/frmDownloadDocumento.aspx?Tela=ext&numProtocolo=747288&descTipo=IPE&CodigoInstituicao=1
13;MYPK3;27/11/2019;19:50;Alteração Diretoria Executiva;https://www.rad.cvm.gov.br/ENET/frmDownloadDocumento.aspx?Tela=ext&numProtocolo=723288&descTipo=IPE&CodigoInstituicao=1
14;MYPK3;27/09/2019;21:21;Êxito em Processo Judicial Tributário;https://www.rad.cvm.gov.br/ENET/frmDownloadDocumento.aspx?Tela=ext&numProtocolo=712935&descTipo=IPE&CodigoInstituicao=1
15;MYPK3;30/08/2019;18:22;Realização da 10ª emissão de debêntures simples não conversíveis em ações;https://www.rad.cvm.gov.br/ENET/frmDownloadDocumento.aspx?Tela=ext&numProtocolo=708891&descTipo=IPE&CodigoInstituicao=1
16;MYPK3;01/08/2019;18:23;Contrato de Compra e Venda de Ações Amsted-Maxion Fundição;https://www.rad.cvm.gov.br/ENET/frmDownloadDocumento.aspx?Tela=ext&numProtocolo=703166&descTipo=IPE&CodigoInstituicao=1
17;MYPK3;27/03/2019;18:05;Aviso aos titulares de Bônus de Subscrição (MYPK12) - Procedimento para exercício;https://www.rad.cvm.gov.br/ENET/frmDownloadDocumento.aspx?Tela=ext&numProtocolo=674116&descTipo=IPE&CodigoInstituicao=1
18;MYPK3;15/03/2019;17:09;Encerramento Programa de Recompra de Ações;https://www.rad.cvm.gov.br/ENET/frmDownloadDocumento.aspx?Tela=ext&numProtocolo=671233&descTipo=IPE&CodigoInstituicao=1
19;MYPK3;15/02/2019;18:37;Aquisição de Ações de Emissão da Própria Companhia;https://www.rad.cvm.gov.br/ENET/frmDownloadDocumento.aspx?Tela=ext&numProtocolo=665912&descTipo=IPE&CodigoInstituicao=1
20;MYPK3;09/01/2019;19:39;9ª emissão de debêntures simples;https://www.rad.cvm.gov.br/ENET/frmDownloadDocumento.aspx?Tela=ext&numProtocolo=659878&descTipo=IPE&CodigoInstituicao=1
21;MYPK3;31/10/2018;19:20;Nova Política de Negociação de Valores Mobiliários e de Divulgação de Informações e modo de divulgação;https://www.rad.cvm.gov.br/ENET/frmDownloadDocumento.aspx?Tela=ext&numProtocolo=648334&descTipo=IPE&CodigoInstituicao=1
22;MYPK3;29/05/2018;18:46;Greve dos caminhoneiros;https://www.rad.cvm.gov.br/ENET/frmDownloadDocumento.aspx?Tela=ext&numProtocolo=626059&descTipo=IPE&CodigoInstituicao=1
23;MYPK3;28/03/2018;19:02;Conversão 6ª emissão de debêntures;https://www.rad.cvm.gov.br/ENET/frmDownloadDocumento.aspx?Tela=ext&numProtocolo=604762&descTipo=IPE&CodigoInstituicao=1
24;MYPK3;19/03/2018;18:38;Encerramento Programa de Recompra de Ações;https://www.rad.cvm.gov.br/ENET/frmDownloadDocumento.aspx?Tela=ext&numProtocolo=601872&descTipo=IPE&CodigoInstituicao=1
25;MYPK3;22/02/2018;20:26;8ª emissão de debêntures simples;https://www.rad.cvm.gov.br/ENET/frmDownloadDocumento.aspx?Tela=ext&numProtocolo=597774&descTipo=IPE&CodigoInstituicao=1
26;MYPK3;20/02/2018;23:23;Aquisição de Ações de Emissão da Própria Companhia;https://www.rad.cvm.gov.br/ENET/frmDownloadDocumento.aspx?Tela=ext&numProtocolo=597400&descTipo=IPE&CodigoInstituicao=1
27;MYPK3;04/10/2017;18:49;Potencial captação de recursos no mercado internacional;https://www.rad.cvm.gov.br/ENET/frmDownloadDocumento.aspx?Tela=ext&numProtocolo=581327&descTipo=IPE&CodigoInstituicao=1
28;MYPK3;24/05/2017;17:08;Encerramento do programa de recompra de ações da Companhia;https://www.rad.cvm.gov.br/ENET/frmDownloadDocumento.aspx?Tela=ext&numProtocolo=565766&descTipo=IPE&CodigoInstituicao=1
29;MYPK3;27/04/2017;18:31;Aquisição de Ações de Emissão da Própria Companhia;https://www.rad.cvm.gov.br/ENET/frmDownloadDocumento.aspx?Tela=ext&numProtocolo=559935&descTipo=IPE&CodigoInstituicao=1
30;MYPK3;03/01/2017;19:12;Capitalização Amsted-Maxion;https://www.rad.cvm.gov.br/ENET/frmDownloadDocumento.aspx?Tela=ext&numProtocolo=543561&descTipo=IPE&CodigoInstituicao=1
31;MYPK3;13/12/2016;18:46;Complemento ao Fato Relevante publicado em 08/12/16;https://www.rad.cvm.gov.br/ENET/frmDownloadDocumento.aspx?Tela=ext&numProtocolo=541891&descTipo=IPE&CodigoInstituicao=1
32;MYPK3;08/12/2016;18:39;Convocação de AGE para aumento do Capital Autorizado para futuro Aumento de Capital Social Privado;https://www.rad.cvm.gov.br/ENET/frmDownloadDocumento.aspx?Tela=ext&numProtocolo=540866&descTipo=IPE&CodigoInstituicao=1
33;MYPK3;19/09/2016;18:29;Encerramento do programa de recompra de ações da Companhia;https://www.rad.cvm.gov.br/ENET/frmDownloadDocumento.aspx?Tela=ext&numProtocolo=531723&descTipo=IPE&CodigoInstituicao=1
34;MYPK3;12/09/2016;17:17;Aquisição de Ações de Emissão da Própria Companhia;https://www.rad.cvm.gov.br/ENET/frmDownloadDocumento.aspx?Tela=ext&numProtocolo=531154&descTipo=IPE&CodigoInstituicao=1
35;MYPK3;18/08/2016;09:29;Cumprimento integral do Termo de Compromisso de Desempenho (CADE);https://www.rad.cvm.gov.br/ENET/frmDownloadDocumento.aspx?Tela=ext&numProtocolo=528503&descTipo=IPE&CodigoInstituicao=1
36;MYPK3;01/08/2016;17:20;Conclusão da operação de subscrição da Amsted-Maxion Fundição;https://www.rad.cvm.gov.br/ENET/frmDownloadDocumento.aspx?Tela=ext&numProtocolo=525569&descTipo=IPE&CodigoInstituicao=1
37;MYPK3;08/07/2016;17:08;Formador de Mercado;https://www.rad.cvm.gov.br/ENET/frmDownloadDocumento.aspx?Tela=ext&numProtocolo=523347&descTipo=IPE&CodigoInstituicao=1
38;MYPK3;19/05/2016;18:02;Celebração de contrato de subscrição e outras avenças;https://www.rad.cvm.gov.br/ENET/frmDownloadDocumento.aspx?Tela=ext&numProtocolo=517982&descTipo=IPE&CodigoInstituicao=1
39;MYPK3;21/03/2016;18:30;Planejamento Sucessório;https://www.rad.cvm.gov.br/ENET/frmDownloadDocumento.aspx?Tela=ext&numProtocolo=505797&descTipo=IPE&CodigoInstituicao=1
40;MYPK3;06/08/2015;20:53;Avaliação para Emissão de Bond no Exterior;https://www.rad.cvm.gov.br/ENET/frmDownloadDocumento.aspx?Tela=ext&numProtocolo=479947&descTipo=IPE&CodigoInstituicao=1
41;MYPK3;01/07/2015;17:24;Venda de Imóveis de Controlada indireta;https://www.rad.cvm.gov.br/ENET/frmDownloadDocumento.aspx?Tela=ext&numProtocolo=476086&descTipo=IPE&CodigoInstituicao=1
42;MYPK3;28/05/2015;17:32;Aquisição de Ações de Emissão da Própria Companhia;https://www.rad.cvm.gov.br/ENET/frmDownloadDocumento.aspx?Tela=ext&numProtocolo=472825&descTipo=IPE&CodigoInstituicao=1
43;MYPK3;06/05/2015;17:35;Conclusão da venda de Participação Acionária da Controlada AmstedMaxion;https://www.rad.cvm.gov.br/ENET/frmDownloadDocumento.aspx?Tela=ext&numProtocolo=469572&descTipo=IPE&CodigoInstituicao=1
44;MYPK3;07/01/2015;09:14;Venda de Participação Acionária da Controlada AmstedMaxion;https://www.rad.cvm.gov.br/ENET/frmDownloadDocumento.aspx?Tela=ext&numProtocolo=451534&descTipo=IPE&CodigoInstituicao=1
45;MYPK3;29/12/2014;18:36;Termo de Compromisso de Desempenho com o Conselho Administrativo de Defesa Econômica;https://www.rad.cvm.gov.br/ENET/frmDownloadDocumento.aspx?Tela=ext&numProtocolo=450999&descTipo=IPE&CodigoInstituicao=1
46;MYPK3;28/05/2014;17:26;Aquisição de Ações de Emissão da Própria Companhia;https://www.rad.cvm.gov.br/ENET/frmDownloadDocumento.aspx?Tela=ext&numProtocolo=427589&descTipo=IPE&CodigoInstituicao=1
47;MYPK3;07/05/2014;09:25;Anúncio de Encerramento de Distribuição Pública;https://www.rad.cvm.gov.br/ENET/frmDownloadDocumento.aspx?Tela=ext&numProtocolo=424303&descTipo=IPE&CodigoInstituicao=1
48;MYPK3;30/04/2014;13:00;Termo de Compromisso de Desempenho com o Conselho Administrativo de Defesa Econômica;https://www.rad.cvm.gov.br/ENET/frmDownloadDocumento.aspx?Tela=ext&numProtocolo=422561&descTipo=IPE&CodigoInstituicao=1
49;MYPK3;29/04/2014;09:48;Anúncio de Início de Distribuição Pública;https://www.rad.cvm.gov.br/ENET/frmDownloadDocumento.aspx?Tela=ext&numProtocolo=421741&descTipo=IPE&CodigoInstituicao=1
50;MYPK3;03/04/2014;14:09;Anúncio de Início de Distribuição Pública;https://www.rad.cvm.gov.br/ENET/frmDownloadDocumento.aspx?Tela=ext&numProtocolo=417886&descTipo=IPE&CodigoInstituicao=1
51;MYPK3;07/03/2014;18:14;Emissão de debêntures;https://www.rad.cvm.gov.br/ENET/frmDownloadDocumento.aspx?Tela=ext&numProtocolo=412891&descTipo=IPE&CodigoInstituicao=1
52;MYPK3;26/02/2014;20:58;Sucessão e Alteração de Membro do Conselho de Administração;https://www.rad.cvm.gov.br/ENET/frmDownloadDocumento.aspx?Tela=ext&numProtocolo=411866&descTipo=IPE&CodigoInstituicao=1
53;MYPK3;19/12/2013;09:22;Primeiro Aditamento ao Acordo de Voto da Iochpe-Maxion S.A.;https://www.rad.cvm.gov.br/ENET/frmDownloadDocumento.aspx?Tela=ext&numProtocolo=405365&descTipo=IPE&CodigoInstituicao=1
54;MYPK3;28/10/2013;09:24;Celebração, Alteração ou Rescisão de Acordo de Acionistas;https://www.rad.cvm.gov.br/ENET/frmDownloadDocumento.aspx?Tela=ext&numProtocolo=398063&descTipo=IPE&CodigoInstituicao=1
55;MYPK3;13/06/2013;18:06;Venda de Imóvel da Controlada Amsted-Maxion;https://www.rad.cvm.gov.br/ENET/frmDownloadDocumento.aspx?Tela=ext&numProtocolo=384841&descTipo=IPE&CodigoInstituicao=1
56;MYPK3;07/05/2013;17:24;Anúncio de Encerramento de Distribuição Pública;https://www.rad.cvm.gov.br/ENET/frmDownloadDocumento.aspx?Tela=ext&numProtocolo=379885&descTipo=IPE&CodigoInstituicao=1
57;MYPK3;04/04/2013;20:53;Oferta Pública de Distribuição de Debêntures Conversíveis;https://www.rad.cvm.gov.br/ENET/frmDownloadDocumento.aspx?Tela=ext&numProtocolo=373884&descTipo=IPE&CodigoInstituicao=1
58;MYPK3;15/03/2013;18:37;Nomes da Chapa de Candidatos a Membros do Conselho de Administração da Companhia;https://www.rad.cvm.gov.br/ENET/frmDownloadDocumento.aspx?Tela=ext&numProtocolo=370245&descTipo=IPE&CodigoInstituicao=1
59;MYPK3;08/03/2013;17:57;Protocolo ANBIMA de Oferta Publica de Debêntures Conversíveis;https://www.rad.cvm.gov.br/ENET/frmDownloadDocumento.aspx?Tela=ext&numProtocolo=369268&descTipo=IPE&CodigoInstituicao=1
60;MYPK3;08/03/2013;09:17;Emissão de Valores Mobiliários;https://www.rad.cvm.gov.br/ENET/frmDownloadDocumento.aspx?Tela=ext&numProtocolo=368901&descTipo=IPE&CodigoInstituicao=1
61;MYPK3;28/02/2013;17:57;Esclarecimentos sobre a distribuição de dividendo + JCP;https://www.rad.cvm.gov.br/ENET/frmDownloadDocumento.aspx?Tela=ext&numProtocolo=367706&descTipo=IPE&CodigoInstituicao=1
62;MYPK3;29/06/2012;17:21;Aquisição de Participação Acionária;https://www.rad.cvm.gov.br/ENET/frmDownloadDocumento.aspx?Tela=ext&numProtocolo=342713&descTipo=IPE&CodigoInstituicao=1
63;MYPK3;05/06/2012;20:36;Intenção de Oferta de Ações;https://www.rad.cvm.gov.br/ENET/frmDownloadDocumento.aspx?Tela=ext&numProtocolo=340073&descTipo=IPE&CodigoInstituicao=1
64;MYPK3;15/05/2012;20:38;Contratação de Formador de Mercado;https://www.rad.cvm.gov.br/ENET/frmDownloadDocumento.aspx?Tela=ext&numProtocolo=337911&descTipo=IPE&CodigoInstituicao=1
65;MYPK3;15/05/2012;18:21;Intenção da Companhia em realizar uma oferta pública primária de ações ordinárias de sua emissão.;https://www.rad.cvm.gov.br/ENET/frmDownloadDocumento.aspx?Tela=ext&numProtocolo=337866&descTipo=IPE&CodigoInstituicao=1
66;MYPK3;25/04/2012;19:29;Aquisição de Ações de Emissão da Própria Companhia;https://www.rad.cvm.gov.br/ENET/frmDownloadDocumento.aspx?Tela=ext&numProtocolo=332796&descTipo=IPE&CodigoInstituicao=1
67;MYPK3;25/04/2012;19:19;Aquisição de Ações de Emissão da Própria Companhia;https://www.rad.cvm.gov.br/ENET/frmDownloadDocumento.aspx?Tela=ext&numProtocolo=332791&descTipo=IPE&CodigoInstituicao=1
68;MYPK3;21/03/2012;16:34;Alteração da Proposta da Administração, arquivada via Sistema IP, em 12/03/12;https://www.rad.cvm.gov.br/ENET/frmDownloadDocumento.aspx?Tela=ext&numProtocolo=325340&descTipo=IPE&CodigoInstituicao=1
69;MYPK3;01/02/2012;18:20;Conclusão da Aquisição da Heyes Lemmerz;https://www.rad.cvm.gov.br/ENET/frmDownloadDocumento.aspx?Tela=ext&numProtocolo=318912&descTipo=IPE&CodigoInstituicao=1
70;MYPK3;23/01/2012;18:25;Conclusão da Aquisição de 100% do Grupo Galaz S.A;https://www.rad.cvm.gov.br/ENET/frmDownloadDocumento.aspx?Tela=ext&numProtocolo=318088&descTipo=IPE&CodigoInstituicao=1
71;MYPK3;10/01/2012;18:06;Conclusão de Negócios na Controlada AmstedMaxion;https://www.rad.cvm.gov.br/ENET/frmDownloadDocumento.aspx?Tela=ext&numProtocolo=317240&descTipo=IPE&CodigoInstituicao=1
72;MYPK3;13/12/2011;10:58;Aprovação do Orgão de Defesa da Concorrência dos Estados Unidos - Aquisição da HL;https://www.rad.cvm.gov.br/ENET/frmDownloadDocumento.aspx?Tela=ext&numProtocolo=314214&descTipo=IPE&CodigoInstituicao=1
73;MYPK3;19/10/2011;08:08;Aquisição de 100% do Grupo Galaz S.A.;https://www.rad.cvm.gov.br/ENET/frmDownloadDocumento.aspx?Tela=ext&numProtocolo=307988&descTipo=IPE&CodigoInstituicao=1
74;MYPK3;17/10/2011;18:17;Venda de vagões pela controlada Amsted-Maxion;https://www.rad.cvm.gov.br/ENET/frmDownloadDocumento.aspx?Tela=ext&numProtocolo=307852&descTipo=IPE&CodigoInstituicao=1
75;MYPK3;05/10/2011;19:02;Celebração de contato para aquisição da Hayes Lemmerz International;https://www.rad.cvm.gov.br/ENET/frmDownloadDocumento.aspx?Tela=ext&numProtocolo=306459&descTipo=IPE&CodigoInstituicao=1
76;MYPK3;08/09/2011;10:32;Esclarecimento sobre Matéria ESTADAO;https://www.rad.cvm.gov.br/ENET/frmDownloadDocumento.aspx?Tela=ext&numProtocolo=303918&descTipo=IPE&CodigoInstituicao=1
77;MYPK3;11/08/2011;19:38;Conclusão de Negócios na Controlada AmstedMaxion;https://www.rad.cvm.gov.br/ENET/frmDownloadDocumento.aspx?Tela=ext&numProtocolo=301528&descTipo=IPE&CodigoInstituicao=1
78;MYPK3;31/05/2011;18:09;Aquisição de Ativo relacionados ao Negócio de Chassis e Estampados;https://www.rad.cvm.gov.br/ENET/frmDownloadDocumento.aspx?Tela=ext&numProtocolo=293044&descTipo=IPE&CodigoInstituicao=1
79;MYPK3;25/05/2011;17:34;Mudança do Agente Escriturador;https://www.rad.cvm.gov.br/ENET/frmDownloadDocumento.aspx?Tela=ext&numProtocolo=292494&descTipo=IPE&CodigoInstituicao=1
80;MYPK3;25/05/2011;17:26;Aquisição de Ações de Emissão da Própria Companhia;https://www.rad.cvm.gov.br/ENET/frmDownloadDocumento.aspx?Tela=ext&numProtocolo=292491&descTipo=IPE&CodigoInstituicao=1
81;MYPK3;03/05/2011;19:04;Conclusão de Negócios na Controlada AmstedMaxion;https://www.rad.cvm.gov.br/ENET/frmDownloadDocumento.aspx?Tela=ext&numProtocolo=289063&descTipo=IPE&CodigoInstituicao=1
82;MYPK3;13/04/2011;17:17;Aquisição de 50% das ações da Montich S.A.;https://www.rad.cvm.gov.br/ENET/frmDownloadDocumento.aspx?Tela=ext&numProtocolo=285541&descTipo=IPE&CodigoInstituicao=1
83;MYPK3;24/03/2011;17:45;Encerramento do Programa de Recompra de Ações;https://www.rad.cvm.gov.br/ENET/frmDownloadDocumento.aspx?Tela=ext&numProtocolo=280612&descTipo=IPE&CodigoInstituicao=1
84;MYPK3;01/03/2011;18:05;Aquisição de Ativos Relacionados ao Negócio de Rodas;https://www.rad.cvm.gov.br/ENET/frmDownloadDocumento.aspx?Tela=ext&numProtocolo=277553&descTipo=IPE&CodigoInstituicao=1
85;MYPK3;11/01/2011;08:30;Conclusão de negócios na controlada AmstedMaxion;https://www.rad.cvm.gov.br/ENET/frmDownloadDocumento.aspx?Tela=ext&numProtocolo=272408&descTipo=IPE&CodigoInstituicao=1
86;MYPK3;24/11/2010;18:16;Aquisição de Ações de Emissão da Própria Companhia;https://www.rad.cvm.gov.br/ENET/frmDownloadDocumento.aspx?Tela=ext&numProtocolo=266882&descTipo=IPE&CodigoInstituicao=1
87;MYPK3;17/11/2010;09:22;Aquisição de Ativos relacionados ao Negocio de Rodas;https://www.rad.cvm.gov.br/ENET/frmDownloadDocumento.aspx?Tela=ext&numProtocolo=266241&descTipo=IPE&CodigoInstituicao=1
88;MYPK3;16/08/2010;09:58;Esclarecimento de Noticia;https://www.rad.cvm.gov.br/ENET/frmDownloadDocumento.aspx?Tela=ext&numProtocolo=256980&descTipo=IPE&CodigoInstituicao=1
89;MYPK3;20/05/2010;09:32;Conclusão de Negócios na Controlada AmstedMaxion;https://www.rad.cvm.gov.br/ENET/frmDownloadDocumento.aspx?Tela=ext&numProtocolo=247320&descTipo=IPE&CodigoInstituicao=1
90;MYPK3;27/04/2010;15:31;Desdobramento de Ações Ordinárias;https://www.rad.cvm.gov.br/ENET/frmDownloadDocumento.aspx?Tela=ext&numProtocolo=242443&descTipo=IPE&CodigoInstituicao=1
91;MYPK3;15/04/2010;17:01;Novos Negócios na Divisão Rodas e Chassis;https://www.rad.cvm.gov.br/ENET/frmDownloadDocumento.aspx?Tela=ext&numProtocolo=240940&descTipo=IPE&CodigoInstituicao=1
92;MYPK3;05/04/2010;09:54;Esclarecimento sobre matéria publicada no Jornal Valor Econômico em 05/04/2010;https://www.rad.cvm.gov.br/ENET/frmDownloadDocumento.aspx?Tela=ext&numProtocolo=238092&descTipo=IPE&CodigoInstituicao=1
93;MYPK3;17/03/2010;18:03;Conclusão de Negócios na Controlada AmstedMaxion;https://www.rad.cvm.gov.br/ENET/frmDownloadDocumento.aspx?Tela=ext&numProtocolo=235033&descTipo=IPE&CodigoInstituicao=1
94;MYPK3;11/02/2010;10:03;Projeto p/ Fabricação de Chassis em Chennai (Índia);https://www.rad.cvm.gov.br/ENET/frmDownloadDocumento.aspx?Tela=ext&numProtocolo=230776&descTipo=IPE&CodigoInstituicao=1
95;MYPK3;08/01/2010;18:11;Conclusão de negócios na Controlada AmstedMaxion;https://www.rad.cvm.gov.br/ENET/frmDownloadDocumento.aspx?Tela=ext&numProtocolo=227471&descTipo=IPE&CodigoInstituicao=1
96;MYPK3;18/12/2009;10:47;Conclusão de negócios na controlada Amsted Maxion;https://www.rad.cvm.gov.br/ENET/frmDownloadDocumento.aspx?Tela=ext&numProtocolo=225596&descTipo=IPE&CodigoInstituicao=1
97;MYPK3;14/12/2009;10:59;Comunicado de Venda de Vagões;https://www.rad.cvm.gov.br/ENET/frmDownloadDocumento.aspx?Tela=ext&numProtocolo=225081&descTipo=IPE&CodigoInstituicao=1
98;MYPK3;02/12/2009;18:04;Adesão ao Programa de Parcelamento de Débitos da Procuradoria Geral da Fazenda Nacional e Secretaria da Receita Federal;https://www.rad.cvm.gov.br/ENET/frmDownloadDocumento.aspx?Tela=ext&numProtocolo=223299&descTipo=IPE&CodigoInstituicao=1
99;MYPK3;01/12/2009;17:14;Plano de Outorga de Opção de Compra de Ações;https://www.rad.cvm.gov.br/ENET/frmDownloadDocumento.aspx?Tela=ext&numProtocolo=223142&descTipo=IPE&CodigoInstituicao=1
